{
  "decision_id": "dec_7f3a2b",
  "trace_id": "trace_10a9f2",
  "organization_id": "org_acme_wealth",
  "investor_id": "inv_33012",
  "actor_or_agent": {
    "type": "ai_agent",
    "id": "agent_rebalance_v2",
    "name": "Rebalance Copilot"
  },
  "mandate": {
    "scope": "propose_only",
    "authorized_actions": ["propose_rebalance"],
    "constraints": ["no_direct_execution"]
  },
  "investor_context": {
    "risk_tolerance": "moderate",
    "time_horizon": "10+ years",
    "investment_policy_summary": "Balanced growth, max 15% single-position concentration"
  },
  "portfolio_context": {
    "as_of": "2026-09-19T00:00:00Z",
    "concentration_summary": "Largest single position is 9% of portfolio"
  },
  "proposed_action": {
    "type": "rebalance",
    "description": "Trim a modest technology overweight from 12% to 10% of portfolio"
  },
  "suitability": {
    "match": true,
    "notes": "Within investment policy concentration limit"
  },
  "policy": {
    "match": true,
    "notes": "No restricted-list or position-limit conflicts"
  },
  "evidence": {
    "sources": ["portfolio_feed", "investment_policy_statement"],
    "reasoning_summary": "Concentration remains within policy after proposed trim"
  },
  "confidence": 0.94,
  "disposition": "PROCEED",
  "created_at": "2026-09-19T00:00:00Z"
}
